{
  "version_schema": "1",
  "contrato_sha256": "3a9412cbf169e74376c00bc8a13fb3ce5669064f9a520d7c69fe30bf7c0021ef",
  "corpus_identidad": "sha256:dddddddddddddddddddddddddddddddddddddddddddddddddddddddddddddddd",
  "relacion": [
    {
      "flujo": "archived/flujo-sintetico",
      "task_id": "T1",
      "ocurrencia": 1,
      "fuente_r2": "cubre",
      "ac": [
        "AC-1"
      ]
    }
  ],
  "exclusiones": [],
  "desacuerdos": [],
  "resoluciones": [],
  "procedencia": {
    "etapas": [
      {
        "etapa": "detectar",
        "quien": "worker sintético",
        "artefacto": "oraculo-evidencia/salidas/"
      },
      {
        "etapa": "comparar",
        "quien": "conductor",
        "artefacto": "oraculo-evidencia/comparacion/"
      },
      {
        "etapa": "adjudicar",
        "quien": "conductor",
        "artefacto": "oraculo-evidencia/comparacion/adjudicaciones.json"
      }
    ],
    "manifest_evidencia": "sha256:eeeeeeeeeeeeeeeeeeeeeeeeeeeeeeeeeeeeeeeeeeeeeeeeeeeeeeeeeeeeeeee",
    "corpus_identidad": "sha256:dddddddddddddddddddddddddddddddddddddddddddddddddddddddddddddddd",
    "familia_conductor": "claude",
    "familia_detector": "gpt-codex",
    "proyeccion_canonica": "proyección sintética del fixture"
  },
  "proxies": [
    {
      "proxy": "gate_estructural_de_git",
      "acredita": "lo que acredita",
      "no_acredita": "lo que no"
    },
    {
      "proxy": "oraculo_congelado_como_autoridad",
      "acredita": "lo que acredita",
      "no_acredita": "lo que no"
    },
    {
      "proxy": "adjudicacion_del_conductor",
      "acredita": "lo que acredita",
      "no_acredita": "lo que no"
    },
    {
      "proxy": "alineacion_del_consumidor",
      "acredita": "lo que acredita",
      "no_acredita": "lo que no"
    },
    {
      "proxy": "clausura_del_grafo_de_dependencias",
      "acredita": "lo que acredita",
      "no_acredita": "lo que no"
    },
    {
      "proxy": "limpieza_de_la_plantilla_del_prompt",
      "acredita": "lo que acredita",
      "no_acredita": "lo que no"
    }
  ]
}
